{
  "$schema": "https://json-schema.org/draft/2020-12/schema",
  "$id": "https://contracts.making-tracks.app/region-config/1",
  "title": "RegionConfig",
  "type": "object",
  "additionalProperties": false,
  "required": ["schema_version", "region_id", "display_name", "bbox", "languages", "sources", "basemap"],
  "properties": {
    "schema_version": {"type": "integer", "const": 1},
    "region_id": {"type": "string", "pattern": "^[a-z][a-z0-9_]*$", "maxLength": 64},
    "display_name": {"type": "string", "minLength": 1, "maxLength": 80, "pattern": "^[^\\u0000-\\u001f\\u007f-\\u009f\\u200b\\u2028\\u2029\\u202a-\\u202e\\u2066-\\u2069\\ufeff]*$"},
    "bbox": {"type": "array", "minItems": 4, "maxItems": 4, "items": {"type": "number", "minimum": -180, "maximum": 180}},
    "languages": {
      "type": "array",
      "minItems": 1,
      "maxItems": 16,
      "items": {"type": "string", "pattern": "^[a-z]{2,3}$"}
    },
    "sources": {
      "type": "object",
      "additionalProperties": false,
      "required": ["wikidata", "wikipedia", "osm", "historic_england", "open_plaques", "national_register"],
      "properties": {
        "wikidata": {"type": "boolean"},
        "wikipedia": {"type": "boolean"},
        "osm": {"type": "boolean"},
        "historic_england": {"type": "boolean"},
        "open_plaques": {"type": "boolean"},
        "national_register": {
          "description": "Optional per-region register. null = none / feasibility pending.",
          "type": ["object", "null"],
          "additionalProperties": false,
          "required": ["id", "enabled"],
          "properties": {
            "id": {"type": "string", "maxLength": 64, "pattern": "^[a-z][a-z0-9_]*$"},
            "enabled": {"type": "boolean"}
          }
        }
      }
    },
    "basemap": {
      "type": "object",
      "additionalProperties": false,
      "required": ["source_pmtiles", "maxzoom", "pack_granularity", "size_budget_bytes", "measured_archive_bytes"],
      "properties": {
        "source_pmtiles": {"type": "string", "maxLength": 2048, "pattern": "^https://[^\\u0000-\\u001f\\u007f-\\u009f\\s]+$"},
        "maxzoom": {"type": "integer", "minimum": 0, "maximum": 15},
        "pack_granularity": {"type": "string", "enum": ["country", "subregion"]},
        "subregions": {
          "type": "array",
          "maxItems": 256,
          "items": {
            "type": "object",
            "additionalProperties": false,
            "required": ["id", "bbox"],
            "properties": {
              "id": {"type": "string", "pattern": "^[a-z][a-z0-9_]*$", "maxLength": 64},
              "bbox": {"type": "array", "minItems": 4, "maxItems": 4, "items": {"type": "number", "minimum": -180, "maximum": 180}}
            }
          }
        },
        "size_budget_bytes": {"type": "integer", "minimum": 1, "maximum": 3221225472},
        "measured_archive_bytes": {"type": "integer", "minimum": 1, "maximum": 3221225472}
      }
    }
  }
}
