{
  "schema_version": 1,
  "region_id": "malaysia",
  "display_name": "Malaysia",
  "bbox": [99.64, 0.85, 119.27, 7.36],
  "languages": ["en"],
  "sources": {
    "wikidata": true,
    "wikipedia": true,
    "osm": true,
    "historic_england": false,
    "open_plaques": true,
    "national_register": {"id": "malaysia_heritage", "enabled": false}
  },
  "basemap": {
    "source_pmtiles": "https://build.protomaps.com/20260714.pmtiles",
    "maxzoom": 14,
    "pack_granularity": "country",
    "size_budget_bytes": 500000000,
    "measured_archive_bytes": 223000000
  }
}
